<?xml version="1.0" encoding="UTF-8"?><!DOCTYPE Styles SYSTEM "../../../../DistFiles/Styles.dtd">
<!-- IMPORTANT NOTE TO MAINTAINERS
	*********************************************************************************************
	ANY change to this Stylesheet must be accompanied by the generation of a new version using
	guidgen. Be sure to validate any changes against Styles.dtd.
	*********************************************************************************************
-->
<Styles date="2016-02-28" DTDver="1610190E-D7A3-42D7-8B48-C0C49320435F" label="Scripture">
	<ImportMappingSets>
		<ImportMapping name="TE Default">
			<mapping id="c" type="style" styleName="Chapter_Number" />
			<mapping id="cap" type="property" propertyName="FigureCaption" />
			<mapping id="cat" type="property" propertyName="FigureFilename" />
			<mapping id="f" type="style" styleName="Note_General_Paragraph" />
			<mapping id="gmb" type="property" propertyName="FigureFilename" /> <!--From Indonesia branch standard-->
			<mapping id="gmbj" type="property" propertyName="FigureCaption" /> <!--From Indonesia branch standard-->
			<mapping id="h" type="property" propertyName="TitleShort" />
			<mapping id="p" type="style" styleName="Paragraph" />
			<mapping id="rem" type="style" styleName="Remark" />
			<mapping id="vt" type="property" propertyName="DefaultParagraphCharacters" />
		</ImportMapping>
	</ImportMappingSets>
</Styles>
